{"$defs":{"fileDigest":{"additionalProperties":false,"properties":{"path":{"type":"string"},"sha256":{"$ref":"#/$defs/sha"}},"required":["path","sha256"],"type":"object"},"refDigest":{"additionalProperties":false,"properties":{"ref":{"type":"string"},"sha256":{"$ref":"#/$defs/sha"}},"required":["ref","sha256"],"type":"object"},"sha":{"pattern":"^[0-9a-f]{64}$","type":"string"}},"$id":"https://atlas-suite.local/schemas/qualification-receipt.schema.json","$schema":"https://json-schema.org/draft/2020-12/schema","additionalProperties":false,"properties":{"bindings":{"additionalProperties":false,"properties":{"adapter_bindings":{"additionalProperties":false,"properties":{"items":{"minItems":1,"type":"array"},"sha256":{"$ref":"#/$defs/sha"}},"required":["items","sha256"],"type":"object"},"environment":{"additionalProperties":false,"properties":{"boundary":{"type":"object"},"sha256":{"$ref":"#/$defs/sha"}},"required":["boundary","sha256"],"type":"object"},"result":{"$ref":"#/$defs/refDigest"},"source_manifest":{"additionalProperties":false,"properties":{"files":{"items":{"$ref":"#/$defs/fileDigest"},"minItems":1,"type":"array"},"sha256":{"$ref":"#/$defs/sha"}},"required":["files","sha256"],"type":"object"},"verification":{"$ref":"#/$defs/refDigest"}},"required":["result","source_manifest","adapter_bindings","environment","verification"],"type":"object"},"claim_ids":{"items":{"type":"string"},"minItems":1,"type":"array","uniqueItems":true},"failures":{"items":{"type":"string"},"type":"array"},"freshness":{"enum":["current","stale"]},"frozen_thresholds":{"additionalProperties":{"type":"number"},"minProperties":1,"type":"object"},"independent_verification":{"type":"boolean"},"profile_id":{"type":"string"},"profile_sha256":{"$ref":"#/$defs/sha"},"proof_limit":{"minLength":1,"type":"string"},"proof_plan_sha256":{"$ref":"#/$defs/sha"},"receipt_id":{"type":"string"},"receipt_sha256":{"$ref":"#/$defs/sha"},"registry_sha256":{"$ref":"#/$defs/sha"},"results":{"additionalProperties":{"type":"number"},"minProperties":1,"type":"object"},"schema":{"const":"atlas-qualification-receipt/2.0"},"status":{"enum":["passed","failed","stale"]}},"required":["schema","receipt_id","claim_ids","profile_id","registry_sha256","profile_sha256","proof_plan_sha256","frozen_thresholds","results","status","freshness","failures","independent_verification","bindings","proof_limit","receipt_sha256"],"title":"Atlas digest-bound qualification receipt 2.0","type":"object"}
