{"bindings":{"adapter_bindings":{"items":[{"adapter":"atlas-context-packet/1.0","component_id":"atlas.evidence-context-plane","contract":{"owner":"Atlas Suite","schema":"atlas-context-packet/1.0","version":"1.0"},"required":true,"source_files":[{"path":"skills/context-atlas/SKILL.md","sha256":"82fa82e0292b1f62052253daa1e5d617a589f93f0b0544118728577799431a93"},{"path":"skills/evidence-rules-atlas/SKILL.md","sha256":"7b8b8f6afe31ca9c86abf6376479bcf200d28de268afaaefc67968276636f0af"}]},{"adapter":"dkg-cli/1.0","component_id":"dkg.rag-evidence-firewall","contract":{"capabilities":["api-schema-projection","atlas-five-core","backend-candidate-submission","backend-read-v1","backend-receipt-verification","domain-mining","domain-qualification","project-atlas-four-file","query-capabilities-16"],"cli_contract":"dkg-cli/1.0","distribution":"deterministic-kg-rag-framework","framework_version":"0.3.0","identity_files":[{"path":"dependency/deterministic-kg-rag-framework/0.3.0/config/framework-interface.json","sha256":"63d0e4d0925c1746592bb427492b7ab074eb0c51b5f22ebb679187ebcf3d61a4"},{"path":"dependency/deterministic-kg-rag-framework/0.3.0/pyproject.toml","sha256":"97deecc92a402ed2f6b70eeb901372bfc2e156496a4a9da8d0821f7c93d203f1"},{"path":"dependency/deterministic-kg-rag-framework/0.3.0/src/dkg/cli.py","sha256":"8ba2b62382c8dd187776f0bccb49320b25328da11a5fed6fef465cefb01dd24f"}],"python_requires":">=3.11","schema":"dkg-framework-interface/1.0"},"required":true,"source_files":[{"path":"scripts/dkg_bridge.py","sha256":"62c606f6aaeda960061d42fcec486754899421072bac637e7f613798bdcff4e5"},{"path":"skills/kg-rag-specialist/SKILL.md","sha256":"fe414821197a0ec6bec91743a306ae3d84b703335b420b3d67a7154995fb6c6c"}]},{"adapter":"atlas-profile/1.0","component_id":"atlas.profile-system","contract":{"owner":"Atlas Suite","schema":"atlas-profile/1.0","version":"1.0"},"required":true,"source_files":[{"path":"qualification/schemas/atlas-profile.schema.json","sha256":"797640078aba007d75ab31be7aa3a7e15b54254d1216cdfeadd1b44620ded1c6"},{"path":"scripts/qualification_core.py","sha256":"7b383b5137d9ba69f31f4a8fc3face2b3a360e10fad0552d12ac5adf9fbc128c"}]}],"sha256":"42c5d4b5dbdbca341952ed6bd7eb33aaf5ac24479b4aa49c6b87180b7c2fa980"},"environment":{"boundary":{"dependencies":{},"dependency_identities":{"dkg":"deterministic-kg-rag-framework/0.3.0","in_the_loop":null,"suite":"atlas-suite-plugin/1.1.0"},"platform":{"machine":"aarch64","system":"Android"},"python":{"implementation":"CPython","version":"3.14.6"},"schema":"atlas-qualification-environment/1.0"},"sha256":"d2f156fe1bbc8fa0151a98cf3b0f39ee3e73a448af9f8a54cc6b19dc47f056ef"},"result":{"ref":"qualification/results/rag-evidence-firewall.result.json","sha256":"27423258337319607358203d2477626c6c4511ad0da9c62f7c56abd9efca1138"},"source_manifest":{"files":[{"path":"qualification/fixtures/fullstack-contract-spine/contract.json","sha256":"a24c80e6835149f9e6bfc8bd9184f91584d836ba1b2d4ceaee1e840694a5d4b8"},{"path":"qualification/profiles/rag-evidence-firewall.atlas-profile.json","sha256":"356ebcd52f15bc2adbfa26d19ac7ebf4b7525fd201744738894a2e9e53176867"},{"path":"qualification/proof-plans/rag-evidence-firewall.proof-plan.json","sha256":"54a80907484805a9e8b36a4c00a6c1f85b7ab5c17b31a09345c4eaa40e55d63e"},{"path":"release-docs/architecture.md","sha256":"d71a044bae89da2479a2a9a1a19a98f556d15fe4a37cbb8e0a101120a46fae4f"},{"path":"scripts/qualification_core.py","sha256":"7b383b5137d9ba69f31f4a8fc3face2b3a360e10fad0552d12ac5adf9fbc128c"},{"path":"scripts/qualification_receipts.py","sha256":"3fa03545b57f058ad7a7b3b15745bd4021c04b2e7733ef515b35b55b110b5a36"},{"path":"scripts/qualification_verifier.py","sha256":"92c2beb48049e0c8a3090ef9464f9af551b42091515936aeb81574a328743dee"}],"sha256":"47dd3a1df9cce0573dca7d9c4959b7b951a35d208d864ab34b69a04a62f9ee92"},"verification":{"ref":"qualification/verifications/rag-evidence-firewall.verification.json","sha256":"bc0691a675e89fcfa321b9487ecb601eeaa2e3c3247e91c26172af30aa10d702"}},"claim_ids":["atlas.evidence-context-plane","dkg.rag-evidence-firewall","atlas.profile-system"],"failures":[],"freshness":"current","frozen_thresholds":{"citation_validity_min":1,"injection_refusal_min":1,"repeatability_min":1,"unsupported_answer_count_max":0},"independent_verification":true,"profile_id":"rag-evidence-firewall","profile_sha256":"356ebcd52f15bc2adbfa26d19ac7ebf4b7525fd201744738894a2e9e53176867","proof_limit":"Local deterministic DKG Harness Boot over one frozen corpus; no provider, remote retrieval, active-knowledge promotion, or general answer-quality claim.","proof_plan_sha256":"54a80907484805a9e8b36a4c00a6c1f85b7ab5c17b31a09345c4eaa40e55d63e","receipt_id":"receipt.rag-evidence-firewall.candidate-1","receipt_sha256":"71ab9eca4aea4b9a73d998690260a756e5f48cdd96992a200be83862bf4e85b5","registry_sha256":"3cfc7fcddeb1013fbe4937c6a6c8969b310381d128de95b72d1d4942cee934ec","results":{"citation_validity_min":1,"injection_refusal_min":1,"repeatability_min":1,"unsupported_answer_count_max":0},"schema":"atlas-qualification-receipt/2.0","status":"passed"}
