{"bindings":{"adapter_bindings":{"items":[{"adapter":"atlas-context-packet/1.0","component_id":"atlas.evidence-context-plane","contract":{"owner":"Atlas Suite","schema":"atlas-context-packet/1.0","version":"1.0"},"required":true,"source_files":[{"path":"skills/context-atlas/SKILL.md","sha256":"82fa82e0292b1f62052253daa1e5d617a589f93f0b0544118728577799431a93"},{"path":"skills/evidence-rules-atlas/SKILL.md","sha256":"7b8b8f6afe31ca9c86abf6376479bcf200d28de268afaaefc67968276636f0af"}]},{"adapter":"atlas-projection-set/1.0","component_id":"atlas.multi-projection-compiler","contract":{"owner":"Project Atlas","schema":"atlas-projection-set/1.0","version":"1.0"},"required":true,"source_files":[{"path":"skills/project-atlas/SKILL.md","sha256":"3271bd52d84736d80363a6f6c06b07e773446397234d3bb3789a764ab5631055"}]},{"adapter":"atlas-contract-spine/1.0","component_id":"atlas.cross-root-contract-spine","contract":{"capabilities":["api-schema-projection","atlas-five-core","backend-candidate-submission","backend-read-v1","backend-receipt-verification","domain-mining","domain-qualification","project-atlas-four-file","query-capabilities-16"],"cli_contract":"dkg-cli/1.0","distribution":"deterministic-kg-rag-framework","framework_version":"0.3.0","identity_files":[{"path":"dependency/deterministic-kg-rag-framework/0.3.0/config/framework-interface.json","sha256":"63d0e4d0925c1746592bb427492b7ab074eb0c51b5f22ebb679187ebcf3d61a4"},{"path":"dependency/deterministic-kg-rag-framework/0.3.0/pyproject.toml","sha256":"97deecc92a402ed2f6b70eeb901372bfc2e156496a4a9da8d0821f7c93d203f1"},{"path":"dependency/deterministic-kg-rag-framework/0.3.0/src/dkg/cli.py","sha256":"8ba2b62382c8dd187776f0bccb49320b25328da11a5fed6fef465cefb01dd24f"}],"python_requires":">=3.11","schema":"dkg-framework-interface/1.0"},"required":true,"source_files":[{"path":"qualification/fixtures/fullstack-contract-spine/contract.json","sha256":"a24c80e6835149f9e6bfc8bd9184f91584d836ba1b2d4ceaee1e840694a5d4b8"},{"path":"qualification/proof-plans/fullstack-contract-spine.proof-plan.json","sha256":"76700a6f7c02ba87f3ca0045952097bbe44ffaf8ae7de34fb0972a34a81fad0d"},{"path":"scripts/qualification_scenarios.py","sha256":"a452ce22cb64d90f97610888a6281dd3fa7f1a5174e733d4cd1cb8973874dae3"}]},{"adapter":"atlas-profile/1.0","component_id":"atlas.profile-system","contract":{"owner":"Atlas Suite","schema":"atlas-profile/1.0","version":"1.0"},"required":true,"source_files":[{"path":"qualification/schemas/atlas-profile.schema.json","sha256":"797640078aba007d75ab31be7aa3a7e15b54254d1216cdfeadd1b44620ded1c6"},{"path":"scripts/qualification_core.py","sha256":"7b383b5137d9ba69f31f4a8fc3face2b3a360e10fad0552d12ac5adf9fbc128c"}]}],"sha256":"eba6ae047df67f197643dd572dde89911128000f10aced5e00e9fd3b4336e6c3"},"environment":{"boundary":{"dependencies":{"fastapi":"0.139.0","httpx":"0.28.1","pydantic":"2.13.4"},"dependency_identities":{"dkg":"deterministic-kg-rag-framework/0.3.0","in_the_loop":null,"suite":"atlas-suite-plugin/1.1.0"},"platform":{"machine":"aarch64","system":"Android"},"python":{"implementation":"CPython","version":"3.14.6"},"schema":"atlas-qualification-environment/1.0"},"sha256":"ca01ca38011bec1416cb3075870e64c321ad9cb102e27ed6b844cba6c937228b"},"result":{"ref":"qualification/results/fullstack-contract-spine.result.json","sha256":"4ac924798b8fd9addacc2c5a90af29b3edec2757daea352228810ad279540096"},"source_manifest":{"files":[{"path":"qualification/fixtures/fullstack-contract-spine/backend/app.py","sha256":"faf78f722cb1b40c85aa3302a7ede4b8e7624ff3c93f014e1e27d0b42f1c346d"},{"path":"qualification/fixtures/fullstack-contract-spine/backend/capabilities.json","sha256":"c6e7d6145dafd8a1864c6442795388253f7dd628efdc5f336242fb4a581beba6"},{"path":"qualification/fixtures/fullstack-contract-spine/backend/openapi.json","sha256":"e23a94d52dd4d5e4017c1f87c110a10b9e46a8d4ce41dad521c69725a3e7021d"},{"path":"qualification/fixtures/fullstack-contract-spine/cases.json","sha256":"b642f5230a92595cfa221a95707e0973b28a9d73b3fb9d1d0f84be4b91fa0eab"},{"path":"qualification/fixtures/fullstack-contract-spine/contract.json","sha256":"a24c80e6835149f9e6bfc8bd9184f91584d836ba1b2d4ceaee1e840694a5d4b8"},{"path":"qualification/fixtures/fullstack-contract-spine/frontend/capabilities.json","sha256":"29dad29c4111885eb3365e1af383e6c61f58a1bc92c3e7b06918b1dc88c75580"},{"path":"qualification/fixtures/fullstack-contract-spine/frontend/src/tasks.tsx","sha256":"22d7a3b5b5b541ea747825b2683a603c6837c9be43d3144d61a9adad6edfe354"},{"path":"qualification/fixtures/fullstack-contract-spine/source-ledger.json","sha256":"c395b7ff708a6463d8a8481cce19566daa7de3f5c0afa2be99fd0a0486ba7bff"},{"path":"qualification/profiles/fullstack-contract-spine.atlas-profile.json","sha256":"f21bf6a429c1d2f5cf4c54ed14a233d9742c0d86b14ef7d765812b2b96830ee7"},{"path":"qualification/proof-plans/fullstack-contract-spine.proof-plan.json","sha256":"76700a6f7c02ba87f3ca0045952097bbe44ffaf8ae7de34fb0972a34a81fad0d"},{"path":"scripts/qualification_core.py","sha256":"7b383b5137d9ba69f31f4a8fc3face2b3a360e10fad0552d12ac5adf9fbc128c"},{"path":"scripts/qualification_receipts.py","sha256":"3fa03545b57f058ad7a7b3b15745bd4021c04b2e7733ef515b35b55b110b5a36"},{"path":"scripts/qualification_scenarios.py","sha256":"a452ce22cb64d90f97610888a6281dd3fa7f1a5174e733d4cd1cb8973874dae3"},{"path":"scripts/qualification_verifier.py","sha256":"92c2beb48049e0c8a3090ef9464f9af551b42091515936aeb81574a328743dee"}],"sha256":"6ea905b86436873e16ed020a1df267a61c65f2c9df0117a6292f95de65f4b12c"},"verification":{"ref":"qualification/verifications/fullstack-contract-spine.verification.json","sha256":"7dcb73a4d80f1b3fc349dacaaffc6f8a3b41b911339030ca4c693f87f8108dc9"}},"claim_ids":["atlas.evidence-context-plane","atlas.multi-projection-compiler","atlas.cross-root-contract-spine","atlas.profile-system"],"failures":[],"freshness":"current","frozen_thresholds":{"compatible_cases_preserved_min":1,"false_negative_count_max":0,"false_positive_count_max":0,"injected_drift_detected_min":8},"independent_verification":true,"profile_id":"fullstack-contract-spine","profile_sha256":"f21bf6a429c1d2f5cf4c54ed14a233d9742c0d86b14ef7d765812b2b96830ee7","proof_limit":"Frozen fixture qualification only; automatic contract testing, deployed HTTP, and production auth compatibility are not claimed.","proof_plan_sha256":"76700a6f7c02ba87f3ca0045952097bbe44ffaf8ae7de34fb0972a34a81fad0d","receipt_id":"receipt.fullstack-contract-spine.candidate-1","receipt_sha256":"0637d9ac66124656db8dcb3b9c9b79d93fc9e3df95c077286093720c8aad32a1","registry_sha256":"3cfc7fcddeb1013fbe4937c6a6c8969b310381d128de95b72d1d4942cee934ec","results":{"compatible_cases_preserved_min":1,"false_negative_count_max":0,"false_positive_count_max":0,"injected_drift_detected_min":9},"schema":"atlas-qualification-receipt/2.0","status":"passed"}
