{"bindings":{"adapter_bindings":{"items":[{"adapter":"atlas-context-packet/1.0","component_id":"atlas.evidence-context-plane","contract":{"owner":"Atlas Suite","schema":"atlas-context-packet/1.0","version":"1.0"},"required":true,"source_files":[{"path":"skills/context-atlas/SKILL.md","sha256":"82fa82e0292b1f62052253daa1e5d617a589f93f0b0544118728577799431a93"},{"path":"skills/evidence-rules-atlas/SKILL.md","sha256":"7b8b8f6afe31ca9c86abf6376479bcf200d28de268afaaefc67968276636f0af"}]},{"adapter":"itl-task-envelope/0.4.1","component_id":"itl.execution-control-plane","contract":{"authoritative_linter":"in-the-loop-codex/scripts/lint_itl.py","authoritative_locker":"in-the-loop-codex/scripts/workflow_lock.py","owner":"In the Loop","production_roster":"in-the-loop-codex/bindings/codex/roster.json","schema":"itl-task-envelope/0.4.1","version":"0.4.1","workflow_contract":"in-the-loop-codex/spec/orchestration-format.md"},"required":true,"source_files":[{"path":"../../../in-the-loop-codex/bindings/codex/roster.json","sha256":"317d89056ffc6b97ba8a3d1df6c9583a3db4a5e84c2406ec255a2b829786e070"},{"path":"../../../in-the-loop-codex/scripts/lint_itl.py","sha256":"60dea512d312ca8e9558034c93519cc71e8d8d7e58871955a7a6070ab51c4005"},{"path":"../../../in-the-loop-codex/scripts/workflow_lock.py","sha256":"8ca8e711d57a86305a9f35e35797e49dc07bb756b375cbf6f71950c10ab26c9d"},{"path":"../../../in-the-loop-codex/spec/core-contract.md","sha256":"3d02fad5f4ad98cf5570908b0f9beef23b72ac77185f8dad64dc8cfbf108d36e"},{"path":"../../../in-the-loop-codex/spec/orchestration-format.md","sha256":"3b2990a78965948c52139dd8922389f53f92ef5baec8f0e9f7382ab8d9f00222"},{"path":"skills/kg-rag-specialist/references/binding/roster.json","sha256":"317d89056ffc6b97ba8a3d1df6c9583a3db4a5e84c2406ec255a2b829786e070"},{"path":"skills/kg-rag-specialist/references/binding/workflows/kg-rag-specialist.itl.md","sha256":"62b2d73c3a0bce94a09f4ac8960dedded795d8481bf260fb8a6dabc0baab35a3"}]},{"adapter":"codex-task-result/1.0","component_id":"codex.acting-host","contract":{"owner":"Codex","schema":"codex-task-result/1.0","version":"task-bound"},"required":true,"source_files":[{"path":"../../../capability-discovery-and-qualification-program.md","sha256":"cd73fec7d285ac05b1195d932106109ac3251d1fee92d97043d694a5ee143ae4"}]},{"adapter":"atlas-itl-grounding/1.0","component_id":"atlas-itl.dual-plane","contract":{"authoritative_linter":"in-the-loop-codex/scripts/lint_itl.py","authoritative_locker":"in-the-loop-codex/scripts/workflow_lock.py","owner":"Atlas Suite","production_roster":"in-the-loop-codex/bindings/codex/roster.json","schema":"atlas-itl-grounding/1.0","version":"1.0","workflow_contract":"in-the-loop-codex/spec/orchestration-format.md"},"required":true,"source_files":[{"path":"../../../capability-discovery-and-qualification-program.md","sha256":"cd73fec7d285ac05b1195d932106109ac3251d1fee92d97043d694a5ee143ae4"},{"path":"../../../in-the-loop-codex/bindings/codex/roster.json","sha256":"317d89056ffc6b97ba8a3d1df6c9583a3db4a5e84c2406ec255a2b829786e070"},{"path":"../../../in-the-loop-codex/scripts/lint_itl.py","sha256":"60dea512d312ca8e9558034c93519cc71e8d8d7e58871955a7a6070ab51c4005"},{"path":"../../../in-the-loop-codex/scripts/workflow_lock.py","sha256":"8ca8e711d57a86305a9f35e35797e49dc07bb756b375cbf6f71950c10ab26c9d"},{"path":"../../../in-the-loop-codex/spec/core-contract.md","sha256":"3d02fad5f4ad98cf5570908b0f9beef23b72ac77185f8dad64dc8cfbf108d36e"},{"path":"../../../in-the-loop-codex/spec/orchestration-format.md","sha256":"3b2990a78965948c52139dd8922389f53f92ef5baec8f0e9f7382ab8d9f00222"}]}],"sha256":"e3df6ed75cd323cd05d05a527bac960f29010005c9218ee7c9aee4fc72284a28"},"environment":{"boundary":{"dependencies":{},"platform":{"machine":"aarch64","system":"Android"},"python":{"implementation":"CPython","version":"3.14.6"},"roots":{"dkg":null,"suite":"dc71dce09af2a686d25a1c3b434369f85c584dddbacffda333f164cb9078613c"},"schema":"atlas-qualification-environment/1.0"},"sha256":"61b116da11fe7256b5524527d0da94d3ef8bb8f4e0a43101abe35641560fbabf"},"result":{"ref":"qualification/results/ai-tool-control-plane.result.json","sha256":"b6e658d597c833e1c6b83ce34e31695f7ea88f7da5e387589ce8e4852619c3ca"},"source_manifest":{"files":[{"path":"../../../in-the-loop-codex/bindings/codex/roster.json","sha256":"317d89056ffc6b97ba8a3d1df6c9583a3db4a5e84c2406ec255a2b829786e070"},{"path":"../../../in-the-loop-codex/scripts/lint_itl.py","sha256":"60dea512d312ca8e9558034c93519cc71e8d8d7e58871955a7a6070ab51c4005"},{"path":"../../../in-the-loop-codex/scripts/workflow_lock.py","sha256":"8ca8e711d57a86305a9f35e35797e49dc07bb756b375cbf6f71950c10ab26c9d"},{"path":"../../../in-the-loop-codex/spec/core-contract.md","sha256":"3d02fad5f4ad98cf5570908b0f9beef23b72ac77185f8dad64dc8cfbf108d36e"},{"path":"../../../in-the-loop-codex/spec/orchestration-format.md","sha256":"3b2990a78965948c52139dd8922389f53f92ef5baec8f0e9f7382ab8d9f00222"},{"path":"qualification/ai-control-plane/context-packet.json","sha256":"73d04a57e93d867e144502e80d8f2d3ebb7214e2d1172c594aa98233f4c281e4"},{"path":"qualification/ai-control-plane/fixture/fixture-contract.json","sha256":"b7020d553a00e4cb27b760c191f5c6f71390e1ea4c108f6faf58afeebc44c308"},{"path":"qualification/ai-control-plane/fixture/golden/task_summary.py","sha256":"8b65a95c19b328749d6aa473dd133447218a9af7443b4c351413ee1ae209e658"},{"path":"qualification/ai-control-plane/fixture/src/__init__.py","sha256":"787efc1d0791e96ef6e1ddeb56c83f26ad1dbe474453aca478c1442078eb43f4"},{"path":"qualification/ai-control-plane/fixture/src/task_summary.py","sha256":"5fe4d9b3d3c13fe7e09e41b156a9685bb4d2366417f74654f332f2a08135508d"},{"path":"qualification/ai-control-plane/fixture/tests/__init__.py","sha256":"ba32bf9069c5a692a66bc2ae751bc7ccab0a0ab8440cf4419b93681900dd7122"},{"path":"qualification/ai-control-plane/fixture/tests/test_task_summary.py","sha256":"ef504e6a0511c8e3273c1f72b585d564a8c295f21918e9760d6700fec40b94d3"},{"path":"qualification/ai-control-plane/locks/orientation.production.lock.json","sha256":"07ad4ce2ac2d3d43dbe7af44af4d30fb287b943975c37f7e77b0df3303312bb2"},{"path":"qualification/ai-control-plane/locks/repair.production.lock.json","sha256":"e3d73ca7aa3aca7ada6cd16adfe6422dfad754fb0fba6739e9572fcccea59adc"},{"path":"qualification/ai-control-plane/negative-cases.json","sha256":"a81f24932273886c573b52d6f7a3d51f41772a37a14dbb8425f48181da811576"},{"path":"qualification/ai-control-plane/runs/ai-control-plane-frozen-1/orientation-report.json","sha256":"c9e79c41a1dd4d2d17cc7a0b65efa8b39c4807e560e1f9f0f52f90a8be50f5c4"},{"path":"qualification/ai-control-plane/runs/ai-control-plane-frozen-1/repair-report.json","sha256":"e3c87b69de9db4223ea0d16f9aeba7ad47f1acf1e05dea6504178eb628c6bbea"},{"path":"qualification/ai-control-plane/runs/ai-control-plane-frozen-1/runtime.json","sha256":"819d09d84c9dfc5cde5153c4c816934c1c5094adf9be8c18ddbb092b6de22461"},{"path":"qualification/ai-control-plane/workflows/qualification-ai-orientation.itl.md","sha256":"3bc476889b0383cd9e8d16d7929e3155cf8572b0ac9b2d0750991b9f47393713"},{"path":"qualification/ai-control-plane/workflows/qualification-ai-repair.itl.md","sha256":"c4a365b68e574e4b03abd67bc265ef8745684209cb078927d8926584c49f9d9e"},{"path":"qualification/profiles/ai-tool-control-plane.atlas-profile.json","sha256":"4ea332495707171c7f6323104618e80f44e4c062ebdbea38a11c832095b31c12"},{"path":"qualification/proof-plans/ai-tool-control-plane.proof-plan.json","sha256":"ec9f0ee28d70313eaac72fcfc64e5710ed7990d0236550f42a6b6b9946af7d42"},{"path":"scripts/qualification_ai_control_plane.py","sha256":"d88809d6488ff0a1770e9808a3fd43c0c814cc4eae8fd3bf9688d10729ab73f6"},{"path":"scripts/qualification_core.py","sha256":"a31096a8596440ae5e486cb1c4c89a7ed25bf6d5bc415458aedcbae9cac9ff31"},{"path":"scripts/qualification_receipts.py","sha256":"f281d96c5de7a4558dc2fd4058ee2da4f9550c4b98594f743cfd82a45be49319"},{"path":"scripts/qualification_verifier.py","sha256":"464b230ccb15e022cb3e63a008890df184d75ffb1387ad9d537790ac847f7de4"}],"sha256":"438af9ba331e3ff097667a06101e39672646c1a6d0ed6e4fa2fc6805ab35bbee"},"verification":{"ref":"qualification/verifications/ai-tool-control-plane.verification.json","sha256":"c5182baff5145c6b67b67d81f797a1871b8e78b060a730c77b0a33e8eaff5619"}},"claim_ids":["atlas.evidence-context-plane","itl.execution-control-plane","codex.acting-host","atlas-itl.dual-plane"],"failures":[],"freshness":"current","frozen_thresholds":{"authority_policy_violations_max":0,"closure_evidence_completeness_min":1,"task_success_min":1,"unsupported_reference_count_max":0},"independent_verification":true,"profile_id":"ai-tool-control-plane","profile_sha256":"4ea332495707171c7f6323104618e80f44e4c062ebdbea38a11c832095b31c12","proof_limit":"One frozen orientation and one frozen deny-then-approved temporary repair. No repeatability, general reasoning, deployment, network, provider, promotion, or publication claim.","proof_plan_sha256":"ec9f0ee28d70313eaac72fcfc64e5710ed7990d0236550f42a6b6b9946af7d42","receipt_id":"receipt.ai-tool-control-plane.candidate-1","receipt_sha256":"c2b1e7fb901ccd72e9eb45c71386d6e769452baecb1b13f7859e1b2cef72ae15","registry_sha256":"72049f51fd831702fcf9e0f4460b9810f37efca8400f15866661917b5b8db20e","results":{"authority_policy_violations_max":0,"closure_evidence_completeness_min":1,"task_success_min":1,"unsupported_reference_count_max":0},"schema":"atlas-qualification-receipt/2.0","status":"passed"}
